{
  "type": "ballistic",
  "tags": ["machine_max:caliber/7_92mm", "machine_max:ammo/tracer"],
  "max_lifetime": 2.0,
  "external": {
    "mass": 0.012,
    "gravity_factor": 1.0,
    "drag_factor": 0.001,
    "caliber": 7.92,
    "base_velocity": 740,
    "base_accuracy_mil": 4.0
  },
  "terminal": {
    "base_penetration": 3,
    "base_damage": 5,
    "penetration_velocity_coefficient": 1.0,
    "damage_velocity_coefficient": 0.5
  },
  "cookoff": {
    "penetration": 0.0,
    "damage": 0.1,
    "impulse": 1.0
  },
  "visual": {
    "tracer_color": [80, 255, 80],
    "tracer_alpha": 255,
    "tracer_light_intensity": 3.0,
    "muzzle_flash": { "intensity": 10.2 }
  },
  "sounds": {
    "fire_sounds": {
      "0.0": {
        "sound_id": "machine_max:projectile.fire.small",
        "range": 128.0
      },
      "800.0": {
        "sound_id": "machine_max:projectile.fire.mg34_loop",
        "range": 128.0
      }
    },
    "cease_fire_sound": {
      "sound_id": "machine_max:projectile.fire.mg34_release",
      "range": 128.0
    },
    "shell_sounds": {
      "0.0": {
        "sound_id": "machine_max:projectile.shell.fall",
        "range": 16.0
      },
      "800.0": {
        "sound_id": "machine_max:projectile.shell.shells_fall",
        "range": 16.0
      }
    }
  }
}
